<?xml version="1.0" encoding="UTF-8"?>
<!--
To change this license header, choose License Headers in Project Properties.
To change this template file, choose Tools | Templates
and open the template in the editor.
-->

<xs:schema xmlns:xs="http://www.w3.org/2001/XMLSchema">

    <xs:element name="libros">
        <xs:complexType>
            <xs:sequence>
                <xs:element name="libro" minOccurs="0" maxOccurs="unbounded">
                    <xs:complexType>
                        <xs:sequence>
                            <xs:element name="titulo" type="xs:string"/>
                            <xs:element name="autor" type="xs:string" maxOccurs="10"/>
                            <xs:element name="isbn" type="xs:string" maxOccurs="1"/>
                            <xs:element name="aÃ±opublicacion" type="xs:string"/>
                        </xs:sequence>
                    </xs:complexType>
                </xs:element>
            </xs:sequence>
        </xs:complexType>
    </xs:element>

</xs:schema>
